Name,Description
Donald Trump, Cabinet Members with negative votes count as positive instead.
Angela Merkel, Influence Cards each give 1 extra point of Influence.
Vladimir Putin, You get 3 extra votes at end of game.
Bashar Al-Assad, You can remove any cabinet members at any time
Kim Kardashian, Place Kim Kardashian as another person's foreign ally when you recruit her
Kim Jong Un, Other players can't use tactic cards against you and you cannot use tactics against other players except for Diplomatic Incident
Xi Jinping, Other players can't outbid you during YOUR TURN.
